severity,title,frequency,frequency_pct,product_area,top_evidence,signal_confidence,quality_flag
P2,Video playback fails when using USB-C audio adapter,1,0.04,Video Player,"[""If you connect from your phone through usb-c to 3.5mm headphone jack, you are locked out of watching video.""]",0.9,pass
P1,Song samples are silent or fail to play,1,0.04,Playback,"[""it doesn't play but now it's muted or doesn't play the song"", ""before it used to play the songs"", ""it doesn't play but now it's muted""]",0.8036,pass
P0,Reported leak of user library and account data,1,0.04,Security,"[""the entire spotify library got leaked"", ""they cant keep your information or cards safe""]",1.0,pass
P1,PS5 application is frequently failing to function correctly,1,0.04,Client App,"[""PS5 app barely ever works as intended""]",0.63,review
P2,Collaborative playlist incorrectly marked as private on Android,1,0.04,Playlists,"[""collaborative playlist isn't accessible to other people"", ""there's an error message saying \""this playlist is private.\"""", ""even tho im not privating it""]",1.0,pass
P1,Spotify Premium Lite plan not recognized for device streaming,1,0.04,Integrations,"[""it is not connecting"", ""It says I need a Spotify Premium account to connect"", ""Spotify not connecting to Volumio streamer""]",0.63,review
P1,Spotify app not working on Chromebook,1,0.04,Client App,"[""experiencing issues with it right now"", ""getting Spotify on my Chromebook has been the issue""]",0.56,review
P2,Sound Capsule feature stuck and not displaying listening days,1,0.04,Personalization,"[""it's been stuck for days"", ""it doesn't show my listening days which it showed previously""]",0.9,pass
P2,Events feature data is stale or incomplete,1,0.04,Events,"[""events\"" feature when it's not updated to keep up with current events"", ""Spotify doesn't seem to know about it""]",0.9,pass
P0,App crashes when accepting price spike agreement,1,0.04,Booking,"[""crashing every time when I try to to accept""]",1.0,pass
P1,Free trial redeemed with points incorrectly requires credit card,1,0.04,Subscription,"[""it required a credit card!"", ""shouldn't be a mandatory thing to use a Credit card."", ""required a credit card!""]",0.8438,pass
P1,App incorrectly detects no Wifi connection on Android/iPad,1,0.04,Connectivity,"[""Not working on Android, saying I'm not connected to Wifi but I definitely am."", ""Also only sometimes works on ipad.""]",0.9,pass
P1,Downloaded content deleted after subscription cancellation,1,0.04,Subscriptions,"[""deleted all the messages I downloaded into my episodes""]",0.9,pass
P1,App UI rendered off-screen due to incorrect TV resolution,1,0.04,Smart TV App,"[""app is opening with higher resolution more then my tv screen"", ""it is not usable app at all""]",1.0,pass
P1,"App spontaneously uninstalls, blocking reinstallation and access",1,0.04,App Infrastructure,"[""The app suddenly disappeared from my phone""]",0.9,pass
P1,Bottom navigation bar overlaps and obstructs screen content,1,0.04,UI/UX,"[""New menu bar blocks 1/5th of screen all the time with no purpose, limiting what I can see printed on Playlists and other screens.""]",0.95,pass
P2,Incorrect subscription renewal date displayed as 1/1/1970,1,0.04,Subscriptions,"[""wrong renew dates- currently says 1/1/1970""]",0.9,pass
P2,Charge amount information is missing from the app,1,0.04,Billing,"[""charge amount- where did it go???""]",0.8,pass
P1,Hulu subscription unexpectedly removed from user accounts,1,0.04,Subscriptions,"[""they took away Hulu from my subscription""]",0.63,review
P2,User perceives decline in overall app quality and stability,1,0.04,Core Experience,"[""quality has been on a steep decline""]",0.49,review
P3,Wrapped feature is missing or not discoverable in UI,1,0.04,Feature Discovery,"[""dov'\u00e8 il mio wrapped""]",0.7,pass
